{
  "schema_version": "1.0",
  "device_id": "dev-example-ac",
  "component_id": "main",
  "from_cache": true,
  "observations": {
    "climate.target_temperature": {
      "value": 26,
      "source": "lan",
      "observed_at": null,
      "received_at": "2026-10-14T05:00:01Z",
      "stale": true
    }
  },
  "warnings": [
    "Fictional cached observation; not a live device response."
  ]
}
